{
  "$schema": "https://json-schema.org/draft/2020-12/schema",
  "$id": "https://raw.githubusercontent.com/Girish-Garg/saboot/main/contracts/schemas/site_note.schema.json",
  "title": "site_note",
  "description": "A resident's note on an existing site, from POST /sites/{id}/notes after moderation. Never carries its author: the notes table keeps only a hash of the user id.",
  "type": "object",
  "additionalProperties": false,
  "required": ["note_id", "site_id", "status", "text", "language", "moderation", "created_at"],
  "properties": {
    "note_id": { "type": "string", "pattern": "^note_[a-z0-9]{1,40}$" },
    "site_id": { "type": "string", "pattern": "^site_[a-z0-9_]{1,40}$" },
    "status": { "enum": ["shown", "hidden"], "description": "hidden when moderation removed the note (toxic or personal data) or could not check it; a hidden note's text is not stored." },
    "text": { "type": ["string", "null"], "maxLength": 280, "description": "The note as shown; null when hidden." },
    "language": { "enum": ["en", "hi"] },
    "moderation": {
      "type": "object",
      "additionalProperties": false,
      "required": ["result", "reasons", "provider", "model", "version"],
      "description": "Same shape and rules as moderation_result.note_moderation (Bedrock only).",
      "properties": {
        "result": { "enum": ["clean", "removed"] },
        "reasons": { "type": "array", "items": { "enum": ["toxic", "personal_data"] } },
        "provider": { "enum": ["bedrock", "comprehend", "junksnap"] },
        "model": { "type": "string" },
        "version": { "type": "string" }
      }
    },
    "created_at": { "type": "string", "format": "date-time" }
  }
}
