{
  "note_id": "note_01k7a2b3c4d5e6f7g8h9j0k1m2",
  "site_id": "site_jdh_1",
  "status": "shown",
  "text": "This pile has been here about 3 months. Someone burns it most weeks and the smoke reaches the school.",
  "language": "en",
  "moderation": { "result": "clean", "reasons": [], "provider": "bedrock", "model": "apac.amazon.nova-pro-v1:0", "version": "v1:0" },
  "created_at": "2026-10-10T09:15:00Z"
}
